{
  "template": "money_leak_meter",
  "seed": 6173,
  "item": "old plans",
  "cost": 400,
  "times_per_month": 3,
  "years": 15,
  "annual_return_pct": 12,
  "style": { "palette": "ember", "genre": "synthwave", "key": "F", "bpm": 108 },
  "text": {
    "hook_title": "{spent} on {item}?",
    "hook_sub": "Apps you forgot to cancel.",
    "hook_tease": "Watch it add up",
    "leak_title": "{times} plans a month",
    "leak_note": "…auto-renewing quietly",
    "meter_title": "Over {years} years",
    "meter_label": "gone on {item}",
    "flip_line1": "What if you",
    "flip_line2": "INVESTED it instead?",
    "grow_title": "Same money at {rate} a year",
    "cmp_title": "Cancel it or keep it?",
    "cmp_line": "{ratio} more from the same money",
    "end_line1": "Check your bank",
    "end_line2": "statement today",
    "end_punch": "Cancel the leak.",
    "end_cta": "Which one did you forget?",
    "end_follow": "Follow for more money maths"
  }
}
