{
  "template": "money_leak_meter",
  "seed": 31877,
  "style": { "palette": "ember", "genre": "lofi", "key": "D", "bpm": 88 },
  "item": "chai and snacks",
  "cost": 120,
  "times_per_month": 30,
  "years": 20,
  "annual_return_pct": 12,
  "text": {
    "hook_title": "{spent} on {item}?",
    "hook_sub": "One {cost} stop a day.",
    "hook_tease": "Watch how it piles up",
    "leak_title": "A stop every single day",
    "leak_note": "Small spends never sleep",
    "meter_title": "Over {years} years",
    "meter_label": "gone on {item}",
    "flip_line1": "What if that money",
    "flip_line2": "went into a SIP?",
    "grow_title": "Same money at {rate} a year",
    "cmp_title": "Sip tea or grow wealth?",
    "cmp_line": "{ratio} more, if returns hold",
    "end_line1": "Keep the chai.",
    "end_line2": "Trim the extras.",
    "end_punch": "Small leaks, big gaps.",
    "end_cta": "Tell us your daily chai spend",
    "end_follow": "Follow for more money maths"
  }
}
